,title,url,text,time
378,"LG이노텍, 4분기도 카메라모듈 힘입어 어닝서프라이즈",https://m.news.naver.com/read.nhn?mode=LSD&mid=sec&sid1=105&oid=366&aid=0000469679,"LG이노텍은 지난해 4분기 연결기준 영업이익 2092억원, 매출 2조9651억원을 기록했다고 29일 밝혔다. 이는 2018년 같은 기간보다 각각 102%, 22% 늘어난 수치다. 같은 기간 순이익은 154억원으로 75.5% 줄었다. LG이노텍 관계자는 ""고성능 카메라모듈 등 프리미엄급 스마트폰에 적용되는 고부가 부품 판매가 늘어 매출과 영업이익이 증가했다""고 설명했다.정철동 LG이노텍 CEO. /LG이노텍 제공LG이노텍(011070)4분기 실적은 증권가 예상치(컨센서스)인 영업이익 1700억원, 매출 2조7400억원을 상회한다. 이로써 LG이노텍은 지난해 총 영업이익 4031억원, 매출 8조3020억원을 기록하게 됐다. 2018년보다 각각 53%, 4% 늘어난 결과다. LG이노텍 관계자는 ""카메라모듈 등을 생산하는 광학솔루션사업과 반도체 기판 등을 생산하는 기판소재사업이 실적 증가를 이끌었다""고 했다.4분기 광학솔루션사업은 전년 동기보다 34% 늘어난 매출 2조2472억원을 기록했다. 스마트폰용 멀티플 카메라모듈 등 고성능∙고품질 제품 판매가 확대된 결과다. 연간 매출은 5조4257억원으로 6.5% 늘었다. LG이노텍은 애플 아이폰에 카메라·3D센싱모듈을 공급하고 있다. 애플은 오는 3월 아이폰SE2를 공개할 것으로 예상돼 추가적인 LG이노텍 실적 개선도 기대된다.기판소재사업은 2018년 4분기보다 8% 줄어든 매출 2862억원을 올렸다. 연간 매출은 1조1261억원으로 2.8% 줄었다. LG이노텍 관계자는 ""반도체 기판과 포토마스크 판매는 늘었지만, 디스플레이 기판 계절적 수요 감소 및 HDI 사업 종료 영향으로 매출이 줄었다""고 했다. 전장부품사업은 4분기 전년보다 14% 증가한 3010억원의 매출을 기록했다. 차량용 모터와 통신모듈 매출이 늘었고, ADAS(첨단운전자지원시스템)용 카메라모듈과 전기차용 파워부품 판매가 늘었다. 연간 매출은 1조1320억원으로 17.5% 증가했다.LED사업의 지난해 4분기 매출은 670억원, 연간 매출은 3546억원이다. 전년보다 각각 29%, 22.3% 줄어든 수치다. LG이노텍은 일반조명용 광원 등 저수익 제품 생산을 줄이고 있다. LG이노텍 관계자는 ""차량용 조명모듈 등 성장성이 높은 제품 중심으로 사업 구조를 효율화 하는 과정에서 매출이 감소했다""고 전했다.[윤민혁 기자 beherenow@chosunbiz.com][조선비즈 창간 10주년 기획 '다시쓰다 도시3.0' 기사 보러가기][네이버 메인에서 조선비즈 받아보기][조선비즈 바로가기] chosunbiz.com",2020-01-29 15:37:08
379,아이폰 판매량 늘면 LG이노텍도 웃는다,https://m.news.naver.com/read.nhn?mode=LSD&mid=sec&sid1=101&oid=015&aid=0004282684,"프리미엄급 스마트폰 속속 출시…눈여겨볼 수혜주는휴대폰 부품주에 대한 기대가 커지고 있다. 애플, 삼성 등이 잇따라 프리미엄급 신제품을 출시한 데 이어 하반기부터 5세대(5G) 이동통신 도입이 본격화될 것으로 예상되기 때문이다.시장조사업체 가트너에 따르면 올해 글로벌 스마트폰 판매량은 전년 대비 3% 늘어날 전망이다. 최보영 교보증권 연구원은 “3년 만에 시장이 반등하는 것”이라며 “스마트폰 출하량 증가와 5G, 폴더블폰 등 기술 변화로 휴대폰 부품주 상승세가 이어질 것”이라고 내다봤다.LG이노텍이 대표적인 수혜주로 꼽힌다. LG이노텍은 지난해 4분기 매출이 2조9651억원으로 전년 동기 대비 22.0% 늘었고, 영업이익은 2092억원으로 102.0% 급증했다. 영업이익은 증권가 컨센서스(추정치 평균)인 1744억원을 20.0% 웃돌았다.아이폰 판매량이 늘어나는 가운데 트리플 카메라 수율이 높아지면서 수익성이 개선되고 있기 때문이다. 올해도 이 같은 흐름이 이어질 것이란 분석이 나온다. 노경탁 유진투자증권 연구원은 “하반기부터 5G 도입이 본격화되면서 멀티 카메라를 사용하는 제품이 늘어날 것”이라고 말했다.삼성전기도 컨센서스를 웃도는 4분기 실적을 발표했다. 삼성전기의 4분기 영업이익은 1386억원으로 증권가 컨센서스(1278억원)를 소폭 웃돌았다. 매출은 1조8456억원으로 전년 동기 대비 5.3% 줄었다.특히 올해부터는 지난해 내내 부진했던 적층세라믹콘덴서(MLCC) 사업부 실적도 개선될 것으로 전망된다. 고의영 하이투자증권 연구원은 “미·중 무역분쟁 이후 침체됐던 수요가 회복되고 있다”며 “5G 스마트폰 출시에 따른 실적 개선도 기대해볼 만하다”고 했다.강영연 기자 yykang@hankyung.com▶ 네이버에서 한국경제 뉴스를 받아보세요▶ 한경닷컴 바로가기  ▶ 모바일한경 구독신청 ⓒ 한국경제 & hankyung.com, 무단전재 및 재배포 금지",2020-02-02 15:59:01
380,[단독]LG이노텍 최대 400% 성과급잔치,https://m.news.naver.com/read.nhn?mode=LSD&mid=sec&sid1=101&oid=277&aid=0004622981,"원본보기[아시아경제 이기민 기자] 지난해 역대 최대 실적을 달성한 LG이노텍이 최대 400%가 넘는 성과급을 지급한다. 고객사인 애플의 스마트폰 판매 호조에 따라 실적이 크게 개선된 덕이다. 성과급 협상에 난항을 겪고 있는 LG그룹 계열사와 다른 모습이다.12일 관련 업계에 따르면 LG이노텍은 오는 21일께 직원들에게 성과급을 지급할 예정이다. 성과급은 사업부별로 기본급의 최대 413%에서 최소 150%까지로 책정됐다. 기판소재사업부 반도체 부품 부서인 PS사업부가 413%로 최대 성과급을 받는다. 기판소재사업부 디스플레이 부품 부서인 DS사업부는 412%로 두 번째로 많은 성과급을 받는다. 광학솔루션사업부와 전자부품사업부의 성과급은 372%로 뒤를 이었다. 다만 중국산 LED로 인한 시황 악화로 실적이 부진한 차량LED사업부는 201%, LED사업부와 전장부품사업부는 150% 수준의 격려금을 받는다. 기본급의 400%가 넘는 성과급은 역대 최대 수준으로 알려졌다. 지난해 실적이 사상 최고치를 찍은 영향이다. LG이노텍의 지난해 매출은 8조3021억원, 영업이익은 4031억원으로 전년 대비 각각 4%, 53% 증가했다.LG이노텍의 성과급은 LG그룹 계열사와 비교해도 돋보인다. LG이노텍과는 다르게 LG그룹의 여타 계열사들은 성과급이 전년보다 적거나 지급 여부 자체가 불투명할 수도 있다는 관측이 나온다. LG전자는 지난해 영업이익이 소폭 감소하면서 성과급도 줄어들 가능성이 있다. LG전자는 지난해 TV 및 국내영업 등 일부 사업부에 기본급의 최대 500%에 해당하는 성과급을 지급했다. LG생활건강도 신종 코로나바이러스감염증(우한폐렴) 등을 이유로 아직 협상을 마무리 짓지 못한 것으로 전해졌다. LG디스플레이 또한 성과급 지급 가능성이 낮다. LG디스플레이는 지난해 LCD 패널 가격 하락으로 역대 최악인 1조3594억원의 영업손실을 기록했다. 에너지저장장치(ESS) 화재 등 각종 악재로 실적이 악화한 LG화학은 최근 석유화학본부에 성과급 100%, 전지ㆍ첨단소재사업본부에 격려금 50만원을 각각 지급하기로 노조와 협의한 것으로 알려졌다.이기민 기자 victor.lee@asiae.co.kr▶ 2020년 신년운세·사주·무료 토정비결 보러가기▶ 네이버에서 아시아경제 뉴스를 확인하세요. ▶ 놀 준비 되었다면 드루와! 드링킷!<ⓒ경제를 보는 눈, 세계를 보는 창 아시아경제 무단전재 배포금지>",2020-02-12 11:53:37
381,"LG이노텍, 광학솔루션 사업에 4,798억원 베팅",https://m.news.naver.com/read.nhn?mode=LSD&mid=sec&sid1=101&oid=011&aid=0003693978,"모바일용 카메라 수요 급증 대비원본보기LG이노텍의 3D 센싱 모듈. /사진제공=LG이노텍[서울경제] LG이노텍(011070)이 올 들어 광학솔루션 사업에 4,798억원의 투자를 단행하며 경쟁력 제고에 나선다. 스마트폰용 멀티플카메라 등 모바일용 고성능 카메라 수요가 급증하며 이에 대응하기 위한 한발 빠른 움직임이다. LG이노텍은 광학솔루션 사업 경쟁력 지속 강화 및 시장 수요 대응을 위한 신규시설투자 명목으로 4,798억원을 올해 말까지 투자한다고 13일 공시했다. 지난해 관련 신규 투자액 규모가 2,821억원이었다는 점에서 올해 신규 투자액이 대폭 상향된 셈이다. LG이노텍의 광학솔루션 사업 부문은 지난해 전년 대비 6.5% 증가한 5조4,257억원의 매출을 기록한 핵심 사업 분야다. 전체 매출에서 차지하는 비중만 65%에 달한다. 이 같은 LG이노텍의 공격적 투자는 올해 애플의 5G용 스마트폰 출시 및 고화질 스마트폰 보급 확대와 관련이 깊다. 특히 올 들어 중국과 미국 등지에서 5세대(5G) 이동통신망 보급이 활성화되며 고화질 동영상 수요도 늘어날 것으로 보인다. 5G는 기존 롱텀에볼루션(LTE) 대비 20배가량 빨라 고용량 데이터 전송에 유리하다. LG이노텍은 지난해 말 스마트폰 메인기판(HDI) 사업에서 손 떼고 반도체기판 사업에 집중한다고 공시하는 등 선택과 집중 전략으로 수익을 빠르게 끌어 올리고 있다. LG이노텍은 지난해 전년 대비 53% 증가한 4,031억원의 영업이익을 기록하기도 했다. LG이노텍 측은 지난해 실적 발표 당시 영업이익 급증과 관련, “고성능 카메라모듈 등 프리미엄급 스마트폰에 적용되는 하이엔드 부품의 판매가 늘어 매출과 영업이익 모두 증가했다”고 밝히기도 했다. 김선우 메리츠증권 연구원은 “이번 투자액 중 60%가량은 트리플 카메라 업그레이드에, 40%가량은 타임오브플라이트(ToF) 모듈 생산라인에 집행될 것으로 보인다”며 “LG이노텍의 광학솔루션 투자액 사이클은 2017년부터 2년간 증가하고 지난해 감소했다가 올해부터 내년까지 카메라 사양 업그레이드에 따라 재차 증가할 것으로 예상된다”고 밝혔다.  /양철민기자 chopin@sedaily.com[서울경제 바로가기]▶ '한 눈에 쏙' 새로워진 서울경제 모바일 페이지를 만나보세요. GO~▶ 네이버 채널에서 '서울경제' 채널 구독해주세요! 저작권자 ⓒ 서울경제, 무단 전재 및 재배포 금지",2020-02-13 16:50:05
382,"""LG이노텍, 상반기 악영향 불가피하나...하반기 멀티플 상향 기대""...목표가 ↑",https://m.news.naver.com/read.nhn?mode=LSD&mid=sec&sid1=101&oid=011&aid=0003701102,"SK증권 리포트[서울경제] SK증권은 LG이노텍에 대해 “신종 코로나바이러스 감염증(코로나19)으로 올해 상반기 악영향은 불가피”하다면서도 “1분기 내 (코로나19가) 진정되면 하반기 (재품) 수요는 예상보다 더 강할 것으로 추정한다”고 27일 전망했다. 투자의견은 ‘매수’로 유지했으며 목표주가는 17만원으로 상향했다.이동주 SK증권 연구원은 “폭스콘 중국 공장이 여전히 차질을 빚고 있고 애플 매장 역시 영업 재개 속도가 더뎌 올해 1·4분기 아이폰 출하량 하향 조정이 필요하다”면서도 “하반기 아이폰 카메라의 스펙 상향엔 변함이 없어 하반기 (아이폰) 출하량에 따라 추가적인 멀티플 상향도 가능할 것”이라고 밝혔다.우선 그는 “아이폰 수탁생산(EMS)을 하는 폭스콘 정저우 공장과 선전 공장 가동이 차질을 빚고 있다. 두 공장은 아이폰 생산의 절반 가량을 담당하는 최대 생산 기지”라며 “블룸버그에 따르면 중국 내 애플 매장 42곳 중 29곳만 영업 재개를 한 상황으로 여전히 더딘 (재개) 속도를 보이고 있다”고 설명했다. 이어 “아이폰 11 판매가 호조를 보이고 있는 시점에서의 사태로 올해 1·4분기 아이폰 출하량은 3,500만대 수준으로 예상보다 저조할 전망”이라고 분석했다.그러나 “아이폰 신제품의 카메라 스팩 상향에는 변함이 없어 보인다”는 게 그의 관측이다. 이 연구원은 “후면 타임투플라이트(ToF), 센서시프트 등 신기술이 적용될 것으로 추정된다”며 “경쟁사의 트리플 카메라 진입도 쉽지 않아 (LG이노텍의) 고객사(애플) 내 점유율은 더욱 견고”하다고 봤다.이어 “카메라 사양, 점유율, 출하량 세 가지가 LG이노텍 주가의 열쇠”라며 “현 시점에는 사양과 점유율의 긍정적인 변화가 감지돼 멀티플 상향 요인으로 충분”하다고 강조했다. 그는 “추가적인 멀티플 상향을 위해선 코로나 이후 하반기 아이폰 래깅 수요의 강도를 봐야 한다”고 설명했다./심우일기자 vita@sedaily.com[서울경제 바로가기]▶ '한 눈에 쏙' 새로워진 서울경제 모바일 페이지를 만나보세요. GO~▶ 네이버 채널에서 '서울경제' 채널 구독해주세요! 저작권자 ⓒ 서울경제, 무단 전재 및 재배포 금지",2020-02-27 09:05:02
383,LG이노텍 구미공장 확진자 발생…카메라모듈 생산 중단,https://m.news.naver.com/read.nhn?mode=LSD&mid=sec&sid1=101&oid=008&aid=0004367064,"[머니투데이 박소연 기자] [공장 전체 폐쇄·방역조치 실시…3일 재가동 예정] 원본보기LG이노텍 구미1A공장 직원이 1일 코로나19(COVID-19) 확진 판정을 받으면서 카메라모듈을 생산하는 해당 공장 생산라인이 가동 중단됐다.LG이노텍에 따르면 구미1A공장 직원 1명이 이날 오후 3시쯤 확진 판정을 받아 해당 생산라인 가동을 중단하고 근무 중이던 직원 전원을 자택에서 대기하도록 조치했다. 공장 전체는 폐쇄 후 방역조치를 실시하고 있다.LG이노텍은 방역을 실시한 후 보건 당국과 협의 하에 오는 3일 구미1A공장을 정상 가동할 예정이다. 구미1A공장에서는 카메라모듈을 생산하고 있다.LG이노텍은 또 임직원들에게 확진자와 이동경로가 겹치거나 발열, 기침, 호흡 곤란, 근육통 등이 있는 임직원은 출근하지 말고 회사에 보고 후 지침에 따라 행동해 줄 것을 안내했다.LG이노텍은 코로나19 확산에 대비해 지난 1월부터 위기대응상황실을 운영해왔다. LG이노텍 관계자는 ""방역 당국에 적극 협력하는 한편 임직원과 고객, 협력사 관계자들의 건강을 최우선에 두고 필요한 모든 조치를 적극 시행해 나갈 방침""이라고 밝혔다.박소연 기자 soyunp@mt.co.kr▶침묵으로 사람을 움직이는 방법▶5년째 생활비 안주는 남편 ▶네이버 구독하기 <저작권자 ⓒ '돈이 보이는 리얼타임 뉴스' 머니투데이, 무단전재 및 재배포 금지>",2020-03-01 18:49:24
384,코로나19에 우는 LG이노텍·LG디스플레이,https://m.news.naver.com/read.nhn?mode=LSD&mid=sec&sid1=105&oid=138&aid=0002083340,"원본보기  - 애플·화웨이 스마트폰 생산 차질   [디지털데일리 김도현기자] 코로나19 확산으로 스마트폰 업계가 흔들리고 있다. 핵심부품을 조달하는 LG이노텍과 LG디스플레이도 울상이다. 주요 고객사의 스마트폰 생산라인 및 양사의 구미사업장 가동에 차질이 생긴 탓이다.    3일 업계에 따르면 애플의 아이폰 공급량이 2분기까지 개선되지 않을 전망이다. 코로나19 발원지인 중국에서 아이폰 90% 이상이 제조되기 때문이다. 주요 생산업체 폭스콘, 페가트론 등은 우한 등 중국 전역에 부품 및 조립공장을 두고 있다.   LG이노텍은 애플의 주요 부품업체다. 카메라 및 3차원(3D)센싱 모듈을 납품하고 있다. 비행시간거리측정(ToF) 모듈 공급도 준비 중이다. 대형사 고객사인 만큼, 애플의 생산 차질은 LG이노텍에 직격탄이다.   애플은 지난달 투자 지침 자료를 통해 “예상보다 중국 현지 공장의 정상화가 늦어지고 있다”며 “목표로 했던 1분기 매출 수준을 달성하기 어려울 것”이라고 밝혔다. 공장 정상화 지연에 따른 공급 부족과 중국 내 매장 폐점으로 인한 영향이다. 이달 말 공개 예정인 보급형 모델 ‘아이폰SE2’도 출시가 연기될 가능성이 높다.   경북 구미 공장에 코로나19 확진자가 발생한 점도 악재다. 지난 1일 LG이노텍 구미 1A 공장 직원 1명이 확진 판정을 받았다. 해당 라인은 카메라모듈을 만드는 곳이다. 당시 LG이노텍은 공장 가동을 중단하고, 방역에 나섰다. 3일부터 공장을 재가동하고 있다. 물량 공급에 큰 타격을 입지는 않았지만, 향후 추가 확진자 발생 우려가 있다.   계열사인 LG디스플레이도 분위기가 좋지 않다. 코로나19 등으로 중국 광저우 8.5세대 유기발광다이오드(OLED) 공장 가동이 지연되고 있다. OLED 유기물 재료 이슈를 해결하면서 1분기 광저우 라인 가동을 예고했지만, 예상치 못한 변수에 가로막혔다. LG디스플레이는 유일한 대형 OLED 공급사로, OLED TV 진영에 영향을 미칠 수 있다.   지난달 29일에는 LG디스플레이 구미사업장 1단지 내 복지동의 한 은행직원이 코로나19 확진자로 판정, 해당 건물을 폐쇄하고 방역을 실시했다. 디스플레이 모듈공장 등 일부 생산시설도 폐쇄 및 방역을 진행했다. 3일부터 정상 가동 중이다.   화웨이의 스마트폰 생산 문제도 부정적이다. 화웨이도 애플과 같은 이유로 공장이 정상 가동되지 못하고 있다. 당초 LG디스플레이는 올해 화웨이에 600만개 이상의 ‘P40 Pro’용 OLED 패널을 공급할 예정이었지만, 현재는 불확실해진 상태다. 코로나19 사태가 길어지자, 화웨이는 올해 스마트폰 목표 출하량을 13% 줄였다.   스마트폰 업계 관계자는 “애플, 화웨이 등의 스마트폰 공장이 제대로 운영되지 못하면서 국내 업체들이 피해를 보고 있다”며 “LG이노텍과 LG디스플레이는 물론 소재·부품·장비 업체들까지 영향권에 포함된다”고 분석했다.   한편 삼성전자도 구미사업장에 잇달아 코로나19 확진자가 발생하면서, 사업장 일부가 폐쇄된 바 있다. 이곳은 삼성전자의 스마트폰 생산기지로 ‘갤럭시Z플립’ 등 접는(Foldable, 폴더블) 스마트폰을 양산하는 공장이 있다.   <김도현 기자>dobest@ddaily.co.kr뉴스채널 설정 - 네이버 메인에서 디지털데일리 뉴스를 볼 수 있어요.IT정보의 즐거운 업그레이드[딜라이트닷넷]<저작권자 © 디지털데일리 무단전재-재배포금지>",2020-03-03 13:15:08
385,"LG이노텍, 하반기 5G 아이폰 출시 효과 기대-키움",https://m.news.naver.com/read.nhn?mode=LSD&mid=sec&sid1=101&oid=018&aid=0004589345,"1분기 코로나19 광학솔루션 매출 차질 불가피하반기에는 회복 기대해볼만[이데일리 권효중 기자] 키움증권은 4일 LG이노텍(011070)에 대해 올해 1분기에는 코로나19로 인해 광학솔루션 부문의 매출에 차질이 예상되지만, 하반기에는 5G 아이폰 출시 등에 대한 기대감을 가질 만하다고 평가했다. 투자의견 ‘매수’와 목표주가 19만원은 모두 유지했다.원본보기김지산 키움증권 리서치센터장은 “1분기는 코로나19로 인해 전략 고객 스마트폰의 생산 차질 및 중국 수요 부진의 영향이 불가피하다”고 설명했다. 김 센터장은 “1분기 중국 스마트폰 판매량은 전년 동기 대비 25%, 세계 스마트폰 판매량은 7% 가량 감소할 것”이라며 “이에 따라 LG이노텍의 1분기 광학솔루션은 기존 예상보다 10%포인트 가량 감소할 것”이라고 내다봤다. 다만 하반기로 갈수록 우상향 흐름을 보일 것이라는 예상이다. 김 센터장은 “전략 고객의 중국 생산 체계가 2분기에 정상화되고, 보급형 모델향 광학솔루션 출하가 본격화되면 실적은 1분기를 저점으로 우상향을 보일 것”이라고 내다봤다. 이어 “하반기에는 5G를 채택한 아이폰 출시 등으로 인한 수혜도 가능하다”고 덧붙였다.한편 1분기 부진을 고려해 키움증권이 새롭게 제시한 올해 LG이노텍의 1분기 매출액은 1조5763억원, 영업이익은 339억원이다. 이는 기존 추정치보다 각각 12.1%, 17.5%씩 줄어든 수치다.권효중 (khjing@edaily.co.kr)네이버 홈에서 ‘이데일리’ 구독하기▶청춘뉘우스~ 스냅타임▶ | 이데일리 기자뉴스룸▶＜ⓒ종합 경제정보 미디어 이데일리 - 무단전재 & 재배포 금지＞",2020-03-04 07:40:02
