,title,url,text,time
252,"""AI가 닭도 키운다""…LG이노텍, 스마트팜 기술개발 추진",https://m.news.naver.com/read.nhn?mode=LSD&mid=sec&sid1=101&oid=001&aid=0010099543,"국립축산과학원과 공동연구 MOU 체결(서울=연합뉴스) 이승관 기자 = LG이노텍은 무인 양계장을 구축하기 위한 '인공지능(AI) 스마트팜 기술' 개발에 나섰다고 22일 밝혔다.    농촌진흥청 산하 국립축산과학원과 공동 추진하는 이번 기술 개발은 가금류 빅데이터를 활용한 딥러닝 기술과 카메라 센싱 기술 등을 융·복합하는 방식으로 진행된다.    이 기술이 개발되면 카메라와 각종 센서가 수만마리 닭의 상태와 날씨 등 환경변화를 자동 분석하고, AI 기술로 양계장의 온도와 습도를 자동으로 제어한다.    또 닭의 발육상태를 분석해 출하 시점을 예측할 수 있도록 하고, 닭의 전염병 감염 증상을 파악해 상태와 위치를 전송함으로써 피해를 최소화하는 데 도움을 준다고 회사 측은 설명했다.    회사 관계자는 ""대규모 양계장의 경우 수만마리를 집단 사육하고 있어 고병원성 조류인플루엔자(HPAI) 등 전염병에 매우 취약하다""면서 ""기술이 개발되면 이에 발 빠르게 대응할 수 있을 것""이라고 말했다.    국립축산과학원은 닭의 성장단계별 행동분석 연구 및 관련 표준 개발을 담당하고, LG이노텍은 카메라 및 온·습도 센서 등으로 이뤄진 계측시스템과 딥러닝 알고리즘을 개발한다.    LG이노텍은 이미 네트워크 카메라를 통한 개체 인식 기술과 닭의 이상 움직임 검출 알고리즘 등 기반 기술을 확보했으며, 오는 2020년까지 양계 농가 현장에 실제로 적용 가능한 수준으로 기술 완성도를 높인다는 계획이다.    LG이노텍 권일근 최고기술책임자(CTO) 전무와 국립축산과학원 양창범 원장, 가금연구소 문홍길 소장 등은 지난 21일 전북 완주군 국립축산과학원에서 관련 업무협약(MOu)를 체결했다.원본보기    권일근 LG이노텍 CTO(앞줄 왼쪽에서 두 번째)와 양창범 국립축산과학원 원장(왼쪽에서 세 번째), 문홍길 가금연구소 소장(왼쪽에서 네 번째)이 21일 전북 완주군 국립축산과학원에서 '양계 스마트팜 기술개발 공동연구 업무협약(MOU)'을 체결한 후 관계자들과 기념 촬영을 하고 있다. [LG이노텍 제공=연합뉴스]    humane@yna.co.kr▶기사제보 및 문의▶내 생활에 흥이나는 최신 트렌드  ▶사진구매 문의",2018-05-22 10:00:01
253,"[fnRASSI]LG이노텍, 3.82% 오르며 거래량 증가",https://m.news.naver.com/read.nhn?mode=LSD&mid=sec&sid1=101&oid=014&aid=0004027551,"LG이노텍(011070)의 현재 거래량이 최근 5거래일 거래량의 최고치를 넘어섰다. 그리고 LG이노텍은 3일 연속 상승흐름을 보이며, 11시 8분 현재 3.82% 증가한 136,000원에 거래중이다.   퀀트 재무분석, 종합점수 36점으로 상승                     지표               항목               값               종합점수                 성장성               매출액증가율               0.07               6.83                 자기자본증가율               0.03                 안정성               부채비율               166.31               6.2                 유동비율               108.81                 이익안정성               8.61                 수익성               ROA               2.48               5.1                 ROE               6.6                 영업이익율               3.19           LG이노텍의 퀀트 재무 점수는 18.13점으로 3개월 이전 15.14점보다 올랐다. 지난 분기에 비해 성장성 점수가 상승했다. 이는 매출액 증가율과 자기자본 증가율이 증가하였기 때문이다. 안정성 종합 점수는 유동비율 하락, 실적 안정성 악화로 하락했다. 수익성 측면에서 볼때 ROA, ROE, 영업이익률 모두 하락하여 이전보다 낮은 점수를 받았다. 외국인/기관 순매수, 개인은 순매도(한달누적)  전일까지 기관이 2일 연속, 외국인이 10일 연속 각각 동종목을 순매수 했다. 4주간을 기준으로 보면 외국인이 순매수량을 늘리며 222,442주를 순매수했고, 기관도 매수 우위를 유지하면서 95,940주를 순매수했다. 반면 개인들은 매도 관점으로 접근하면서 318,382주를 순매도한 것으로 나타났다. 'fnRASSI'는 증권전문 기업 씽크풀과 파이낸셜뉴스의 협업으로 로봇기자가 실시간으로 생산하는 기사입니다.   fnRASSI@fnnews.com fnRASSI ▶ 세상의 모든 골 때리는 이야기 'fn파스'▶ 속보이는 연예뉴스 fn스타  ※ 저작권자 ⓒ 파이낸셜뉴스. 무단 전재-재배포 금지",2018-05-25 11:11:04
254,"LG이노텍, '열전 반도체 테크 포럼' 개최",https://m.news.naver.com/read.nhn?mode=LSD&mid=sec&sid1=101&oid=003&aid=0008617458,"6월20일 마곡 LG사이언스파크서 공개 포럼반도체로 에너지 변환하는 열전 기술 소개원본보기【서울=뉴시스】김동현 기자 = LG이노텍이 친환경 열전 반도체 기술을 선보이는 공개 포럼을 연다.LG이노텍은 오는 6월20일 서울시 강서구 마곡 LG사이언스파크에서 '열전 반도체 테크 포럼'을 개최한다고 27일 밝혔다. 이번 포럼은 열전 반도체 기술 활용을 촉진하고 여러 기업·기관과 협력 기회를 만들어 나가기위해 마련됐다. 열전 반도체 기술은 반도체에 전력을 공급해 냉각·가열 기능을 구현하고, 반대로 온도차를 이용해 전력을 생산하는 혁신 기술이다. 냉매나 열선 없이 간편하게 온도를 제어할 수 있고, 폐열(廢熱)을 회수하여 전기에너지로 재활용할 수 있어 환경 친화적이다.이 기술은 주로 소형 냉장고, 냉온 정수기 등 생활 가전과 차량 공조장치 등에 활용되고 있다. 최근에는 대형 가전, 의료기기 등의 냉각 장치와 자동차, 선박, 공장의 폐열 발전 등으로 확대되고 있다LG이노텍 '열전 반도체 테크 포럼'의 테마는 '열전 기술로 만들어가는 Eco-friendly & Convenient life'다. 완제품의 편의성과 디자인을 혁신하고 친환경 장점을 강화할 수 있는 열전 반도체의 가치를 알게 될 것이란 설명이다.이번 포럼에서는 한국전기연구원 열전기술연구센터 책임연구원 박수동 박사(한국열전연구회 회장), 연세대학교 신소재공학과 이규형 교수 등 전문가들이 기술 동향과 적용 분야에 대해 발표한다. 또 가전, 자동차, 선박 등 주요 업계 관계자들이 나와 산업현장에서 실제로 활용하고 있는 생생한 사례를 소개한다.이와 함께 LG이노텍은 이번 포럼에서 열전 소재부터 소자, 모듈까지 독자 기술로 내재화한 열전 반도체 솔루션과 향후 R&D 로드맵을 발표할 계획이다. 참가자들이 직접 제품을 확인해 볼 수 있도록 전시부스도 마련한다.회사 관계자는 ""이번 포럼은 친환경 열전 반도체 기술의 가치와 미래 활용 가능성을 엿볼 수 있는 자리가 될 것""이라고 말했다.oj1001@newsis.com▶ 뉴시스 빅데이터 MSI 주가시세표 바로가기 ▶ 뉴시스 SNS [페이스북] [트위터]<저작권자ⓒ 공감언론 뉴시스통신사. 무단전재-재배포 금지.>",2018-05-27 10:33:36
255,"LG이노텍, 중국서 'UV LED 포럼' 개최",https://m.news.naver.com/read.nhn?mode=LSD&mid=sec&sid1=101&oid=003&aid=0008622772,"29일 선전서 개최, 업계 관계자 700여명 참석UV LED 기술·제품 동향 및 현지 활용 사례 소개원본보기【서울=뉴시스】LG이노텍이 기술 동향을 공유하는 'UV LED 포럼'을 29일 중국 광둥성 선전에서 개최했다고 30일 밝혔다. 박종석 LG이노텍 사장이 포럼 참석자들에게 인사말을 하고 있다. 2018.05.30 (사진 = LG이노텍 제공) photo@newsis.com【서울=뉴시스】이종희 기자 = LG이노텍이 기술 동향을 공유하는 'UV LED 포럼'을 29일 중국 광둥성 선전에서 개최했다고 30일 밝혔다. UV(자외선) LED는 자외선을 방출하는 첨단 반도체 광원이다. 파장에 따라 세균·바이러스를 없애고, 특수 물질과 화학 반응하는 특성이 있어 물·공기·표면 살균, 의료·바이오, 경화·노광 장치 등에 사용된다.L G이노텍은 중국을 UV LED 잠재 수요가 가장 큰 시장으로 보고 해외 포럼의 첫 무대로 삼았다. 친환경 UV LED의 뛰어난 성능과 폭넓은 활용 분야를 글로벌 시장에 직접 알리며 주도권을 확보하겠다는 의지다.이번 포럼에는 중국 가전, 위생, 의료, 제조설비 등 현지 업계 관계자만 700여 명이 참석해 성황을 이뤘다. 박종석 LG이노텍 사장은 인사말에서 ""UV LED는 우리의 삶을 깨끗하고 안전하게 만들어 줄 수 있는 혁신 제품""이라며 ""산업 생태계가 빠르게 확대될 수 있도록 여러 분야의 전문가들과 적극 협력해 나갈 것""이라고 말했다.이날 기조 강연은 공학분야 전문성을 자랑하는 대만 국립교통대학(National Chiao Tung University)의 홍레이화(Horng Ray-Hua) 교수가 나와 UV LED의 활용 가치에 대해 설명했다.이어서 세계 3대 네일큐어링장비업체 중 하나인 UV LED Optical의 오양천이(Ouyang Chenyi) 대표와 정수·정화용 UV 모듈을 생산하는 HCEN의 샹위(Xiang Yu) 상품기획총괄, 생활가전용 UV 모듈업체 HaidUV의 완티안웨이(Wan Tianwei) 총경리 등 업계 관계자들이 현재 중국 시장에서 이뤄지는 UV LED 활용 사례를 소개했다.이와 함께 강동현 서울대 농업생명과학대학 교수가 UV LED의 살균력 실증 연구결과를 발표했다. 그는 광출력 100밀리와트(mW) UV-C LED가 식중독을 유발하는 살모넬라균을 3.4초만에 99.9% 없애는 등 뛰어난 살균 효과를 보였다고 설명했다.송준오 LG이노텍 LED사업부장은 제품 라인업과 개발 로드맵 등을 소개했다. 그는 ""지난해 살균용 UV LED 광출력을 100mW까지 높인데 이어 올해는 150mW, 2019년에는 200mW까지 높여 나갈 계획""이라고 말했다.행사장에는 UV LED 전시 부스도 마련됐다. 세계 최고 광출력 100mW UV-C LED 등 30여 종의 UV LED 패키지와 독자 개발한 살균 모듈, 응용 제품 등이 전시되어 방문객들의 많은 관심을 받았다.LG이노텍 관계자는 ""UV LED에 대한 중국 업체들의 많은 관심을 확인 할 수 있었다""며 ""기존 완제품의 기능과 품질을 차별화하고 환경 및 위생 이슈를 해결하는 데 UV LED를 활용하려는 의지를 엿볼 수 있었다""고 말했다.2papers@newsis.com▶ 뉴시스 빅데이터 MSI 주가시세표 바로가기 ▶ 뉴시스 SNS [페이스북] [트위터]<저작권자ⓒ 공감언론 뉴시스통신사. 무단전재-재배포 금지.>",2018-05-30 08:34:29
256,"LG이노텍, 협력사와 장애인 재활시설 봉사활동",https://m.news.naver.com/read.nhn?mode=LSD&mid=sec&sid1=101&oid=003&aid=0008634875,"4일 안산시 '어린양의 집'서 공동 봉사활동산책 돕고 텃밭 가꾼 후 재활시설 필요 물품 기부원본보기【서울=뉴시스】LG이노텍 임직원들과 협력사 대표들이 4일 경기도 안산시 중증장애인 재활시설 '어린양의 집'을 찾아가 혼자 외출하기 힘든 장애인들의 산책을 돕고 청소, 텃밭 가꾸기 등 봉사활동을 했다고 5일 밝혔다. 2017.06.05 (사진 = LG이노텍 제공) photo@newsis.com【서울=뉴시스】이종희 기자 = LG이노텍이 협력사 대표들과 함께 4일 경기도 안산시 중증장애인 재활시설 ‘어린양의 집’을 찾아 봉사활동을 했다고 5일 밝혔다. 이번 봉사활동은 LG이노텍 임직원과 협력사 대표들이 매년 두 차례 모여 진행하는 공동 사회공헌 프로그램의 하나다. 비즈니스를 넘어 봉사도 함께 하자는 협력사 대표들의 제안으로 지난 2011년부터 지속하고 있다.이날 양사 임직원 30여명은 장애인들이 청결한 곳에서 생활할 수 있도록 숙소를 청소하고 주변 잡초를 제거했다. 신선한 채소를 기를 텃밭도 가꿨다.또한, 봉사활동 참가자들은 혼자 외출하기 힘든 중증 장애인들을 위해 ‘어린양의 집’ 주변을 함께 산책하며 이야기를 나눴다.아울러, 양사 대표들은 장애인들이 편히 쉴 수 있는 침대와 복지 업무를 신속히 처리할 수 있는 최신 사무용 복합기를 기부했다. ‘어린양의 집’에서 필요로 하는 물품들을 미리 확인해 준비했다.LG이노텍 관계자는 ""작지만 실질적인 도움을 주려는 협력사 대표들과 함께 자발적으로 마련된 봉사활동""이라며 ""장애인들이 사회 구성원으로서 당당히 살아가길 바라는 마음""이라고 말했다.2papers@newsis.com▶ 뉴시스 빅데이터 MSI 주가시세표 바로가기 ▶ 뉴시스 SNS [페이스북] [트위터]<저작권자ⓒ 공감언론 뉴시스통신사. 무단전재-재배포 금지.>",2018-06-05 08:59:30
257,어닝쇼크라더니…LG이노텍 주가 30%↑,https://m.news.naver.com/read.nhn?mode=LSD&mid=sec&sid1=101&oid=009&aid=0004164471,"1·2분기 연속 실적 부진에도 하반기 반등기대에 주가 우상향기관·外人 한달새 2200억 순매수원본보기 실적 부진의 늪에 빠진 LG이노텍이 주식시장에선 도리어 선전을 이어가고 있어 주목된다. 1분기 어닝쇼크에 이어 2분기엔 영업적자를 기록할 것이란 전망이 우세하지만 실적 회복 속도가 예상보다 빠를 것이란 전망이 나오고 있다.7일 한국거래소에 따르면 LG이노텍은 유가증권시장에서 4월 말 대비 현재 주가가 29.6% 상승했다. 당시 11만원대에 불과했던 주가는 이날 장중 15만4500원까지 오르는 등 최근 3개월래 최고치를 기록했다. LG이노텍은 지난 3개월 동안 주가 상승률 33.8%(장중 최고·최저치 기준)를 기록했다.이처럼 LG이노텍 주가가 우상향 흐름을 지속할 수 있었던 것은 실적 개선 가능성에 대한 기대감 때문이라는 분석이 나온다. LG이노텍은 공시를 통해 1분기 영업이익이 168억원으로 전년 동기 대비 74.8% 감소했다고 밝힌 바 있다. 이는 시장 예상치(369억원) 절반에도 못 미치는 수준이다. 그러나 투자자들은 2분기 이후 실적 방향성에 더욱 주목하는 분위기다. 일단 LG이노텍 매출의 60%가량을 책임지는 광학솔루션 사업부가 1분기에 이어 2분기에도 적자를 기록할 것으로 예상되면서 전 사 실적이 좋지 않을 것이라는 전망이다. 그럼에도 시장 전문가들은 2분기 비수기를 통과한 후 3·4분기엔 실적 반등에 성공할 것이라는 관측을 내놓았다. 2분기는 주요 고객사의 신규 스마트폰이 출시되기 전 재고 조정 기간에 해당되기 때문에 부품사인 LG이노텍에는 실적 저점에 해당된다.에프앤가이드에 따르면 LG이노텍은 2분기에 영업적자 192억원을 기록할 것으로 예상됐다. 만약 LG이노텍이 2분기 영업손실을 기록하면 이는 2016년 2분기 이후 8개 분기 만의 적자 전환하는 셈이다. 그러나 3분기에는 영업이익이 1026억원으로 전년 동기 대비 83.5% 증가할 것으로 관측됐다. 이어 4분기 영업이익(1828억원)도 지난해 4분기 때보다 29.5% 늘어날 것이란 전망이다. 연간으로는 올 상반기 부진한 탓에 영업이익이 지난해 2965억원에서 올해 2809억원으로 5.3% 감소할 것으로 관측됐다. 그러나 내년엔 이보다 많은 영업이익 4417억원을 거두는 등 실적이 개선될 것으로 예측됐다.김지산 키움증권 연구원은 ""LG이노텍의 실적 회복 속도가 예상보다 빠를 것으로 예상된다""며 ""2분기 영업손실은 시장 우려보다 양호한 편인 데다 하반기엔 (주요 고객사인 애플의) 새로운 아이폰 사이클과 더불어 실적이 급속하게 개선될 것""이라고 내다봤다. 키움증권은 LG이노텍의 2분기 영업손실 규모(예상치)를 종전 172억원 적자에서 114억원 적자로 조정했다.김 연구원은 ""극단적인 재고 조정을 겪었던 올해 상반기와 달리 내년 상반기에는 합리적인 수요 예측과 더불어 부품 출하 스케줄을 전제로 할 때, 올해 대비 강한 실적 모멘텀을 이어갈 것으로 예상된다""며 LG이노텍 목표주가를 18만원에서 20만원으로 올려 잡았다. 최근 미래에셋대우도 ""LG이노텍이 3분기부터 애플 신제품 효과를 볼 것""이라며 목표가를 16만2000원에서 18만원으로 상향 조정한 바 있다.증권가의 이 같은 전망은 기관과 외국인 투자자들 투자 패턴에도 그대로 나타나고 있다. 5월 이후 현재까지 기관과 외국인은 LG이노텍을 각각 548억원, 1686억원 순매수했다. 1분기 실적 공시일인 4월 24일 이후로도 기관(534억원)과 외국인(1028억원)은 순매수 기조를 유지했다. 특히 외국인은 5월 이후 단 한 차례(5월 9일·6억원 순매도)를 제외하고 모두 '사자' 행렬을 이어갔다. 개인투자자들만 5월 이후 현재까지 LG이노텍을 2264억원어치 팔아치웠다.다만 전문가들은 최근 LG이노텍 주가가 단기 급등 장세를 이어왔다는 점에서 추가 조정 가능성도 염두에 둬야 한다고 강조했다. 이런 맥락에서 LG이노텍의 실적 회복 속도에 따라 긴 호흡을 갖고 투자에 접근할 것을 제안했다. [고민서 기자]▶뉴스 이상의 무궁무진한 프리미엄 읽을거리 ▶아나운서가 직접 읽어주는 오늘의 주요 뉴스[ⓒ 매일경제 & mk.co.kr, 무단전재 및 재배포 금지]",2018-06-07 17:42:06
258,"LG이노텍, 나노 다결정 소재 적용...열전 반도체 시장 공략",https://m.news.naver.com/read.nhn?mode=LSD&mid=sec&sid1=101&oid=003&aid=0008647994,"독자 개발 소재 적용, 기존 대비 강도 2.5배...냉각 효율 30% 향상가전 저소음·슬림화, 통신 부품 온도 제어, 차량·선박 폐열 발전 가능 열전 소재·소자·모듈의 R&D, 생산·품질 토털 솔루션 제공원본보기【서울=뉴시스】LG이노텍은 나노 다결정 소재를 적용한 열전 반도체 개발에 성공, 최근 구미 공장에 소재 생산라인 구축을 완료했다고 12일 밝혔다. 사진은 LG이노텍이 나노 다결정 소재를 적용해 개발한 열전 반도체 소자. 2018.06.12 (사진 = LG이노텍 제공) photo@newsis.com【서울=뉴시스】이종희 기자 = LG이노텍이 나노 다결정 열전(Thermoelectric) 반도체 기술로 본격적인 열전 반도체 시장 공략에 나선다.LG이노텍은 나노 다결정 소재를 적용한 열전 반도체 개발에 성공, 최근 구미 공장에 소재 생산라인 구축을 완료했다고 12일 밝혔다. 이 제품은 내년 상반기 양산에 들어갈 계획이다. 열전 반도체는 전기를 공급해 냉각·가열 기능을 구현하고, 온도 차를 이용해 전력을 생산하는 혁신 부품이다. 열전 반도체에 전기가 흐르면 한쪽은 발열, 반대쪽은 냉각되는 '펠티어 효과(Peltier effect)'와 양쪽에 온도차를 주면 전력을 발생하는 '제벡 효과(Seebeck effect)'를 이용한다.시장조사업체 테크나비오(TechNavio)에 따르면 열전 반도체 글로벌 시장 규모는 지난해 4억 7155만 달러에서 2020년 6억2673만 달러로 성장할 전망이다.이번에 개발된 LG이노텍의 열전 반도체는 이 회사가 독자 개발한 나노 다결정 소재를 적용했다. 나노 다결정 소재는 10억분의 1미터 수준인 나노미터(nm) 단위의 초미세 결정 구조를 구현했다. 이를 통해 기존 단결정 소재의 강도와 효율을 높여 냉장고 등 가전제품에서 차량·선박 등으로 적용 범위를 확대했다.나노 다결정 소재는 단결정 소재 대비 2.5배 이상 강도가 높아 진동으로 소재가 깨지기 쉬운 차량·선박 등에 적용이 가능한 특장점이 있다. 또한, 열저항을 최소화시킨 자체 모듈 구조를 적용해 단결정 열전 반도체 모듈 대비 냉각 효율을 30% 높여 동일 온도로 냉각 시 소비전력을 최대 30%까지 낮출 수 있다.LG이노텍의 열전 반도체를 냉장고, 정수기 등 소형 가전에 장착하면 가전의 크기와 소음을 줄일 수 있다. 컴프레서 방식의 소형 냉장고 소음이 29dB(데시벨)이라면, 열전 반도체 적용 시 소음을 최대 19dB(데시벨)까지 낮출 수 있다. 이는 방송국 스튜디오(20dB)보다도 작은 수준이다. 생활 가전의 크기도 컴프레서 방식 대비 최대 40%까지 작고 얇게 만들 수 있다.LG이노텍의 열전 반도체 기술은 통신 분야에도 활용이 가능하다. 광 송·수신기 등 통신용 데이터 전송 장비에 열전 반도체를 적용하면, 광통신 부품의 온도를 일정하게 유지시켜 데이터 손실을 최소화할 수 있다. 광통신 부품은 일정 온도가 유지되지 못하면 파장 변화, 출력 감소 등으로 데이터 전송 효율이 저하되어 통신 성능에 영향을 미칠 수 있다.아울러 차량 및 선박에 적용 시, 운행 중 발생돼 버려지는 열을 전기로 변환해 재활용함으로써 필요 연료와 배출되는 유해가스를 줄일 수 있다. 예를 들어 차량은 1600cc 디젤 자동차 기준, 연비가 리터당 18km일 경우, 열전 반도체를 적용하면 리터당 19.8km로 약 9~12%의 연비 향상이 가능하다. 선박도 열전 반도체를 적용하면 이산화탄소 배출 저감 효과가 있어 2020년부터 강화되는 국제해사기구(IMO)의 선박 대기오염 배출규제 대응에 유리해질 수 있다.LG이노텍 관계자는 ""LG이노텍은 열전 반도체의 소재·소자·모듈의 R&D부터 생산, 품질관리에 이르는 토털 서비스 제공이 가능하다""며 ""차별화된 나노 다결정 소재와 모듈화 기술 확보로 가전뿐 아니라 통신, 차량·선박, 산업용·웨어러블 기기 등으로 열전 반도체 적용 분야를 더욱 넓혀갈 수 있을 것""이라고 말했다.한편, LG이노텍은 열전 반도체 시장 활성화를 위해 오는 20일 서울시 강서구 마곡 LG사이언스파크에서 업계 전문가들을 초청해 '열전 반도체 테크 포럼'을 개최한다.이번 열전 반도체 테크 포럼은 일반인도 참가할 수 있으며, 포럼 홈페이지에서 참가 신청 하면 된다.2papers@newsis.com▶ 뉴시스 빅데이터 MSI 주가시세표 바로가기 ▶ 뉴시스 SNS [페이스북] [트위터]<저작권자ⓒ 공감언론 뉴시스통신사. 무단전재-재배포 금지.>",2018-06-12 08:34:10
