,title,url,text,time
126,"LG이노텍, 협력사와 동반성장 목표 다져",https://m.news.naver.com/read.nhn?mode=LSD&mid=sec&sid1=105&oid=003&aid=0007843352,"원본보기【서울=뉴시스】김지은 기자 = LG이노텍이 22일 협력사들과의 동방성장을 강화해 나가기로 했다. 이 회사는 이날 경기도 화성시 라비돌 리조트에서 협력사 대표 및 임원 130여 명을 초청해 '동반성장 아카데미'를 개최했다. 동반성장 아카데미는 사업에 실질적으로 도움이 되는 정보를 제공하는 협력사 지원 프로그램이다. R&D·경제· CSR 등 분야별 최신 동향과 대응방안 등을 공유한다. 이번 행사는 LG이노텍과 대중소기업협력재단이 동반성장문화 확산을 위해 마련한 것으로 올해로 4년째 지속되고 있다. LG이노텍은 올해 글로벌 이슈 대응과 미래 준비에 중점을 뒀다. 국내외 정치·경제적 변화가 사업에 미칠 영향을 고려해서다. 이와 함께 협력사들이 상생 지원 제도를 적극 활용할 수 있는 내용도 소개했다.  이날 제현정 한국무역협회 통상협력실 차장은 '미국의 통상정책 방향과 시사점'에 대해 발표했다.  조용수 LG경제연구원 수석연구위원은 '기술 빅뱅 시대의 미래 준비'에 대해 강연했다. 참가자들은 이 강연을 통해 4차 산업혁명 등 변화 속에서 생존전략을 모색하는 기회를 가졌다. 이전 대중소기업협력재단 차장은 협력사들이 활용할 수 있는 다양한 동반성장 지원제도를 소개했다. 특히 기술보호 지원제도, 내일채움 공제사업 등 사업 경쟁력 강화와 직결된 지원제도를 설명했다.  이날 행사는 LG이노텍과 협력사 간 소통의 장으로 이어졌다. LG이노텍 구매 부서장들과 협력사간 분임토의 시간을 마련해 동반성장 활동에 대한 협력사의 다양한 의견을 수렴했다. 매년 행사에 참가한 이재현 ㈜오알켐 대표는 ""시급한 사업이슈를 해결하다 보면 시장 변화에 한발 앞서 대응하기가 쉽지 않다”며 “오늘 행사를 통해 주요 이슈를 짚어보고 아이디어를 얻을 수 있었다""고 말했다. LG이노텍은 협력사의 경쟁력 강화에 중점을 두고 동반성장 활동을 지속 추진해 나갈 방침이다. 회사는 지난 1월 100여 개 협력사와 ‘공정거래협약’을 체결하고 금융·기술·경영·교육 분야 지원을 약속한 바 있다. whynot82@newsis.com뉴시스 뉴스, 네이버 뉴스 스탠드에서도 만나세요뉴시스 SNS [페이스북] [트위터]<저작권자ⓒ 공감언론 뉴시스통신사. 무단전재-재배포 금지.>",2017-03-22 14:25:29
127,"LG이노텍, 협력사 초청 ‘동반성장 아카데미’ 4년째 지속",https://m.news.naver.com/read.nhn?mode=LSD&mid=sec&sid1=101&oid=050&aid=0000043792,"원본보기(사진= LG이노텍 '동반성장 아카데미' 개최/LG이노텍 제공)[한경비즈니스=김서윤 기자] LG이노텍은 22일 경기도 화성시 라비돌 리조트에서 협력사 대표 및 임원 130여 명을 초청해 ‘동반성장 아카데미’를 개최했다. LG이노텍과 대중소기업협력재단이 동반성장문화 확산을 위해 마련한 것으로 올해로 4년째다.동반성장 아카데미는 사업에 실질적으로 도움이 되는 정보를 제공하는 협력사 지원 프로그램으로 연구개발(R&D), 경제, 기업의 사회적 책임(CSR) 등 분야별 최신 동향과 대응방안 등을 공유한다.LG이노텍은 올해 글로벌 이슈 대응과 미래 준비에 중점을 뒀다. 국내외 정치·경제적 변화가 사업에 미칠 영향에 대해 논하고 협력사들이 상생 지원 제도를 적극 활용할 수 있도록 안내하는 시간을 마련했다.제현정 한국무역협회 통상협력실 차장은 ‘미국의 통상정책 방향과 시사점’에 대해 발표했다. 최근 미국의 통상 압력이 구체화 되는 상황에서 참석자들로부터 많은 관심을 받았다.조용수 LG경제연구원 수석연구위원은 ‘기술 빅뱅 시대의 미래 준비’에 대해 강연했다. 참가자들은 이 강연을 통해 4차 산업혁명 등 변화 속에서 생존전략을 모색하는 기회를 가졌다는 평이다.이전 대중소기업협력재단 차장은 협력사들이 활용할 수 있는 다양한 동반성장 지원제도를 소개했다. 특히 기술보호 지원제도, 내일채움 공제사업 등 사업 경쟁력 강화와 직결된 지원제도를 자세히 설명해 큰 호응을 얻었다.LG이노텍과 협력사 간 소통의 장도 마련됐다. 이재현 ㈜오알켐 대표는 “시급한 사업이슈를 해결하다 보면 시장 변화에 한발 앞서 대응하기가 쉽지 않다”며 “오늘 행사를 통해 주요 이슈를 짚어보고 아이디어를 얻을 수 있었다”고 말했다.LG이노텍은 협력사의 경쟁력 강화에 중점을 두고 동반성장 활동을 지속적으로 추진해 나갈 방침이라고 밝혔다. 회사는 지난 1월 100여 개 협력사와 ‘공정거래협약’을 체결하고 금융·기술·경영·교육 분야 지원을 약속한 바 있다. socool@hankyung.com",2017-03-23 20:33:03
128,"[ET투자뉴스]LG이노텍, ""LG이노텍 주가 연…"" 매수-바로투자증권",https://m.news.naver.com/read.nhn?mode=LSD&mid=sec&sid1=101&oid=030&aid=0002596086,"바로투자증권에서 29일 LG이노텍(011070)에 대해 ""LG이노텍 주가 연초 대비 57% 급등에도 추가 상승 전망""라며 투자의견을 '매수'로 제시하였고, 아울러 목표주가로는 170,000원을 내놓았다. 바로투자증권 박성순, 김지훈 애널리스트가 동종목에 대하여 이번에 제시한 '매수'의견은 바로투자증권의 직전 매매의견을 그대로 유지하는 것이고 전년도말의 매매의견을 기준으로  볼때도 역시 '매수'의견이 계속 유지되고 있는 상태이다. 그리고 최근 분기내 발표된 전체 증권사 리포트의 컨센서스와 비교를 해볼 경우에 오늘 발표된 투자의견은 전체의견에 수렴하고 있어, 이번 의견은 시장의 평균적인 기대감이 객관적으로 표현된 것으로 분석되고 있다. 목표주가의 추이를 살펴보면 과거 상향조정되어오던 패턴이 한차례 정체구간을 보낸 후에 이번에 다시 상향조정되는 모습이다. 또한 전일 종가 기준으로 볼때 동종목의 현주가는 이번에 제시된 목표가 대비 22.7%의 저평가 요인이 존재한다는 해석이 제시되고 있다. 원본보기◆ Report briefing바로투자증권에서 LG이노텍(011070)에 대해 ""동사 주가는 연초대비 약 +57%의 가파른 상승세를 보이고 있으나 당사는 목표주가를 상향하며 추가적인 주가 상승을 전망한다. 하반기 북미 고객사향 듀얼 카메라의 적용 모델 확대로 인한 탑재율 증가에 따라 광학솔루션 사업부의 호실적이 지속될 것으로 예상된다""라고 분석했다.  또한 바로투자증권에서 ""LG이노텍 듀얼카메라의 독점적 지위가 지속되는 가운데 듀얼카메라의 수요가 1월까지는 양호한 것으로 파악되기 때문에 예년 대비 광학솔루션 사업부의 1Q17 실적 감소세는 다소 완만할 것으로 전망한다""라고 밝혔다.  한편 ""4Q16 일회성 비용이 반영되며 적자전환하였던 기판소재 사업부는 적자사업 매출 축소 및 HDI 부문 개선으로 흑자전환할 것으로 예상한다. 동사의 1Q17 매출액 1.63조원(+36.2% YoY, -20.8% QoQ), 영업이익 733억원(+18,026.9% YoY, -37.8% QoQ)으로 예상된다""라고 전망했다. ◆ Report statistics목표주가는 130,000원이 고점으로, 반대로 110,000원이 저점으로 제시된 이후 이번에 170,000수준으로 새롭게 조정되고 있다. 한편 증권정보제공 업체인 씽크풀에 따르면 동사에 대한 컨센서스는 '매수'이고 목표주가는 과거 상향조정되어오던 패턴이 한차례 정체구간을 보낸 후에 이번에 다시 상향조정되는 추세이다. <컨센서스 하이라이트> 컨센서스최고최저투자의견매수매수(유지)HOLD목표주가138,368170,000100,000*최근 분기기준오늘 바로투자증권에서 발표된 '매수'의견 및 목표주가 170,000원은 전체의견에 수렴하면서 시장의 평균적인 기대감이 비교적 객관적으로 표현된 것으로 풀이되며 목표가평균 대비 22.9% 초과하고 있는 것으로 집계되었다.  참고로 최근 증권사 매매의견 중에서 제일 보수적인 의견을 제시한 유안타증권에서 투자의견 '매수(유지)'에 목표주가 100,000원을 제시한 바 있다. <바로투자증권 투자의견 추이> 의견제시일자투자의견목표가격20170329매수170,00020170125매수130,00020170102매수130,00020161114매수110,00020161031매수110,000<최근 리포트 동향>의견제시일자증권사투자의견목표가20170329바로투자증권매수170,00020170324KB증권매수(유지)160,00020170320하이투자증권매수(유지)160,00020170320이베스트투자증권매수(유지)155,000(씽크풀에서 제공하는 컨센서스는 국내 전증권사에서 발표되는 기업분석 리포트 및 코멘트를 실시간으로 통계/분석처리되고 있습니다.)증시분석 전문기자 로봇 ET etbot@etnews.com전자신문과 씽크풀의 증시분석 전문기자 로봇 ET가 쓴 기사입니다▶ 전자신문 인기 포스트▶ 전자신문 공식 페이스북▶ 전자신문 바로가기 [Copyright ⓒ 전자신문 & 전자신문인터넷, 무단전재 및 재배포 금지]",2017-03-29 10:18:03
129,[CEO연봉]박종석 LG이노텍 사장 연봉 10억5200만원,https://m.news.naver.com/read.nhn?mode=LSD&mid=sec&sid1=101&oid=003&aid=0007862935,"원본보기【서울=뉴시스】이연춘 기자 = LG이노텍은 31일 공시를 통해 박종석 LG이노텍 사장에게 연봉 10억5200만원을 지급했다고 밝혔다. LG이노텍이 이날 공개한 사업보고서에 따르면 박 사장의 급여는 10억5200만 원을 받았다. 상여나 주식매수선택권 행사이익, 기타 근로소득은 없다.  LG이노텍은 기본급에 대해 “집행임원 인사관리규정 등 보수 관련 규정에 따라 직급 등을 반영해 1월~3월에는 5300만원을, 4월~12월에는 5500만원을 매월 지급했다”고 설명다. 또한 “직책수당은 집행임원 인사관리규정 등 보수 관련 규정에 따라 직무 및 역할 중요성 등을 반영해 1월~3월에는 3200만원을, 4월~12월에는 3300만원을 매월 지급했다”면서 “기타복리후생으로는 임직원복리후생 규정에 따라 300만원을 지급했다”고 덧붙였다.  lyc@newsis.com 뉴시스 뉴스, 네이버 뉴스 스탠드에서도 만나세요뉴시스 SNS [페이스북] [트위터]<저작권자ⓒ 공감언론 뉴시스통신사. 무단전재-재배포 금지.>",2017-03-31 16:32:29
130,"IBK투자증권 ""LG이노텍 장기 성장 국면…목표가↑""",https://m.news.naver.com/read.nhn?mode=LSD&mid=sec&sid1=101&oid=001&aid=0009163740,"(서울=연합뉴스) 권수현 기자 = IBK투자증권은 LG이노텍이 광학솔루션 사업부를 중심으로 성장 국면에 들어섰다며 5일 목표주가를 기존 14만5천원에서 18만원으로 올렸다.    김운호 IBK투자증권 연구원은 ""LG이노텍이 과거에 성장과 쇠퇴를 반복하던 구간에서 장기 성장 국면에 진입해 올해 실적은 예년과 크게 다를 것으로 기대된다""고 분석했다.     김 연구원은 ""광학솔루션 사업부가 성장을 주도하고 전장부품도 외형이 커지겠다. 지금까지 성장에 발목을 잡았던 발광다이오드(LED), 일반부품, 주기판(HDI)의 수익성이 개선될 것""이라며 ""상당 기간 진행된 구조조정의 결과도 올해 구체화할 것""이라고 예상했다.     LG이노텍의 올해 1분기 매출액은 1조6천993억원, 영업이익은 766억원으로 계절적 요인 때문에 전 분기보다는 감소하나 전년 동기 대비로는 큰 폭으로 개선될 것으로 전망했다. 특히 영업이익은 광학솔루션을 제외한 전 사업부가 전 분기보다 늘어날 것으로 내다봤다.    김 연구원은 ""올해 안정적 실적 개선이 기대된다. 특히 국내 부품업체 가운데 애플의 최대 벤더로 하반기 신제품 효과가 예상되며 현재 주가의 저평가 매력도 높다""며 투자의견 '매수'를 유지했다.     inishmore@yna.co.kr최신 유행 트렌드 총집결 #흥(클릭!)",2017-04-05 08:30:41
131,"LG이노텍 ""일본 연구소 폐쇄, 절차상 일시적인 것""",https://m.news.naver.com/read.nhn?mode=LSD&mid=sec&sid1=105&oid=003&aid=0007875062,"원본보기【서울=뉴시스】김지은 기자 = LG이노텍이 일본 연구소 폐쇄에 대해 ""효율성 감소 문제가 아니라 절차상 필요성으로 폐쇄를 의결한 것""이라고 밝혔다. 6일 LG이노텍은 일본 연구소 폐쇄 건에 대해 ""일시적으로 폐쇄를 의결한 게 맞다""며 ""하지만 철수를 했거나 효율성 감소 등이 원인이 아니다. 운영 효율에 따라 변동이 필요해서 절차상으로 폐쇄를 의결하게 된 것""이라고 설명했다. LG이노텍이 일본 요코하마에 설립한 연구소는 LED와 인쇄회로기판 등의 부품 등을 다루고 있다. LG이노텍은 연구소 설립 신고가 법인이 아니라 지점 성격으로 돼 있는 만큼, 필요에 의해 절차상의 폐쇄가 필요했다고 답했다. LG이노텍은 최근 듀얼카메라 판매 호조와 전장부품 신규수주 증가, 포토마스크 등 디스플레이 부품의 고수익성 유지, LED부문의 적자폭 개선 등에 따라 높은 실적을 기대하며 성장 견인에 박차를 가하고 있다. whynot82@newsis.com뉴시스 뉴스, 네이버 뉴스 스탠드에서도 만나세요뉴시스 SNS [페이스북] [트위터]<저작권자ⓒ 공감언론 뉴시스통신사. 무단전재-재배포 금지.>",2017-04-06 14:06:57
132,"LG이노텍, '코크 살균' UV LED모듈 양산",https://m.news.naver.com/read.nhn?mode=LSD&mid=sec&sid1=105&oid=003&aid=0007881200,"원본보기LG전자 '퓨리케어' 정수기에 장착, 코크 내부 직접 살균작은 크기, 뛰어난 살균력, 인체에 무해…UV LED 본격 확대【서울=뉴시스】이연춘 기자 = LG이노텍은 '정수기 코크 살균용 UV LED모듈'을 파주 사업장에서 지난달 말부터 본격 양산했다고 10일 밝혔다.  LG이노텍이 개발한 UV LED모듈은 코크 내부의 물을 자외선으로 직접 살균, 살균력이 뛰어나고 인체에 무해하다. 이 제품은 LED 패키지에 전자회로기판 등을 결합하고도 크기가 가로 1.5, 세로 3.7센티미터(㎝)로 작아 코크 내부 장착이 가능하다. 실제로 이 제품은 자외선을 코크에 5분간 쬐어 세균을 99.98% 제거해준다. 세균 걱정을 더 이상 하지 않아도 된다. 278나노미터(nm) 파장으로 살균한 효과다. 또한 LG이노텍 UV LED모듈은 화학 약품이나 중금속 없이 순수하게 자외선 빛으로만 살균한다. 기존의 수은 UV 램프와 달리 깨질 걱정이 없어 안심이다. 이와 함께 이 제품은 반도체 소자로 만든 첨단 광원으로 자외선을 빠르고 정밀하게 제어할 수 있어 편리하다. 살균 기능을 작동하는 즉시 최대 성능으로 자외선을 방출한다. 수은 UV램프는 약 2분 정도 예열이 필요한 반면에 LG이노텍의 UV LED모듈은 예열이 필요 없다. 이 제품을 장착한 LG전자의 퓨리케어 정수기는 사용자가 필요할 때 언제든지 '셀프 케어' 버튼을 눌러 곧바로 코크를 살균할 수 있다. 또 1시간 마다 스스로 자동 살균한다. LG이노텍은 UV LED의 적용 분야를 적극 확대할 방침이다. 이번 코크 살균 제품의 양산으로 우수한 성능을 입증했다. 이 회사는 지난달 세계 최초로 자외선 출력이 70mW에 달하는 280nm UV-C LED를 개발한 바 있다. LG이노텍은 이미 살균용 280nm UV-C LED 외에도 일반 산업용인 365nm, 385nm, 395nm, 405nm UV-A LED 및 바이오·의료용 305nm UV-B LED 등 각 용도에 최적화된 제품 라인업을 확보했다. 아울러 에피웨이퍼, 칩, 패키지, 모듈의 LED 일관 생산체제를 갖춰 안정적인 제품 공급으로 글로벌 시장 공략에 자신 있다는 게 회사측 설명이다. 이처럼 세계 최고 수준의 LED 기술을 보유하고 있다는 점이 LG이노텍의 강점이다는 것. 정호림 LED마케팅담당(상무)은 ""UV LED를 사용해 완제품의 가치를 높이고 사용자의 건강을 한층 스마트하게 케어 할 수 있다""며 ""보다 편리하고 안전한 혁신 제품을 지속 선보여 나갈 것""이라고 말했다. lyc@newsis.com뉴시스 뉴스, 네이버 뉴스 스탠드에서도 만나세요뉴시스 SNS [페이스북] [트위터]<저작권자ⓒ 공감언론 뉴시스통신사. 무단전재-재배포 금지.>",2017-04-10 09:30:21
133,"NH투자 ""LG이노텍 올해 사상최대 실적…목표가 올려""",https://m.news.naver.com/read.nhn?mode=LSD&mid=sec&sid1=101&oid=001&aid=0009181264,"(서울=연합뉴스) 유현민 기자 = NH투자증권은 12일 LG이노텍이 올해 사상 최대 실적을 기록할 전망이라며 목표주가를 11만원에서 17만원으로 올렸다.     고정우 연구원은 ""LG이노텍의 1분기 실적은 매출액 1조6천억원, 영업이익 786억원으로 추정된다""며 ""광학솔루션 부문이 실적 개선을 견인했을 것""이라고 설명했다.     그는 ""실적이 대폭 개선될 것이라는 전망을 유지하며 올해 영업이익 추정치를 3천703억원으로 상향조정한다""며 ""광학솔루션 사업부의 올해 전사 이익 기여도를 80%로 전망한다""고 분석했다.     고 연구원은 ""듀얼카메라를 장착한 스마트폰이 늘고 있는 만큼 모듈 공급 단가 프리미엄이 유지되는 가운데 동사의 모듈 공급 물량이 증가할 것""이라며 ""특히 듀얼 카메라 모듈 생산능력의 우위가 지속해서 강화될 것""이라고 내다봤다.     그는 ""올해 차량용 전장부품 사업부의 실적 기여 확대도 뚜렷해질 전망""이라며 투자의견 '매수'를 종전대로 유지했다.     hyunmin623@yna.co.kr최신 유행 트렌드 총집결 #흥(클릭!)",2017-04-12 08:11:59
134,[단독]아반떼 리콜은 LG이노텍 중국인 산업연수생 때문? 도대체 무슨 일이···,https://m.news.naver.com/read.nhn?mode=LSD&mid=sec&sid1=103&oid=032&aid=0002780100,"LG그룹 소재·부품 계열사 LG이노텍에서 일하던 중국인 산업연수생들이 낮은 임금 등 처우에 불만을 품고 생산된 전기모터 제품을 고의로 훼손하는 일이 발생했던 것으로 알려졌다. 이 모터는 국내 최대 자동차 부품 생산업체인 현대모비스에 납품돼 ‘전기식 조향장치(Electric power steering)’ 조립에 사용됐다. 전기식 조향장치는 다시 현대자동차 아반떼 등 완성차에 조립됐으나 소비자 불만 신고가 발생해 리콜 조치됐다. 전자식 조향 장치의 전기모터에 이상이 생기면 운전대가 무거워져 방향 전환이 어려워지고 치명적인 사고로 이어질 수 있다. 완성차 협력업체의 부실한 생산관리가 소비자들의 안전을 위협하고 있다는 지적이 나온다. 13일 자동차업계에 따르면 지난달 24일 국토교통부는 현대·기아차에서 제작·판매한 아반떼와 아이오닉, 니로 등 430대를 리콜했다. 이들 차량에 사용된 전기식 조향장치의 모터 커넥터에 결함이 발견된 게 리콜 사유였다. 이 모터는 LG이노텍이 지난해 12월 생산해 현대모비스에 납품한 것으로, 중국인 산업연수생과 한국인 직원들이 같은 생산라인에서 만든 제품인 것으로 알려졌다. 원본보기LG이노텍이 생산 중인 전기식 조향장치용 모터.                                                    LG이노텍 제공LG이노텍은 중국 옌타이와 허이저우에 차량 전기장치와 발광다이오드(LED) 생산라인을 운영하고 있다. 문제의 모터 생산에 참여한 중국인 산업연수생들은 옌타이 법인 소속으로, 40명이 6개월간 국내에 머물며 경기 오산 LG이노텍 공장에서 제품 조립 교육을 받았다. 이들 중 4명이 지난해 12월22일 LG이노텍이 지급하는 임금 등에 불만을 품고 술을 마셨고, 작업장에 들어와 생산된 모터 커넥터 핀을 고의로 훼손한 것으로 알려졌다.결함이 생긴 모터가 사용된 현대·기아차 차량은 2600여대쯤 되는 것으로 파악됐다. 이 가운데 1600여대가 국내외 소비자에게 인도됐다. 앞서 국토부가 국내 리콜을 발표한 430대를 제외한 1200대 가량이 해외 고객에 인도돼 리콜이 진행되고 있다.200여대가 고객에 이미 인도된 미국에서는 기아차 미국 법인이 리콜 실시계획서를 미국 도로교통안전국(NHTSA)에 낸 상태다. 현대차 미국 법인도 무상수리 캠페인을 진행하고 있다.고객에 인도되지 않은 차량에 대해서도 기술진이 점검을 실시하고 있는 것으로 알려졌다. 이밖에 해외 수출을 하기 위해 한국 야적장에 선적 대기 중인 차량도 대부분 점검이 끝난 것으로 전해졌다. 나머지 차량은 미국이 아닌 다른 지역으로 수출됐으나 리콜이나 고객 인도전 점검 여부는 확인되지 않았다. LG이노텍 관계자는 “모터 결함은 중국인 산업연수생이 아닌 현장 직원의 실수로 발생한 것”이라면서 “처음엔 원인 파악이 안돼 중국인 산업연수생이 작업 실수를 한 것이라고 현대모비스 측에 최초 보고했으며 산업연수생은 술을 마시지 않았다”고 말했다. 이에 대해 한 업계 관계자는 “중국인 산업연수생들이 제품을 고의로 훼손한 게 맞다”면서 “당시는 사드 문제로 중국내 반한 감정이 극심할 때여서 혐한 감정 때문에 제품을 훼손한 줄 알았으나 임금 문제가 원인인 것으로 최종 확인된 것으로 안다 ”고 말했다.<김준 선임기자 jun@kyunghyang.com>▶ [경향비즈 바로가기], 경향비즈 SNS [페이스북] ▶ [인기 무료만화 보기][©경향신문(www.khan.co.kr), 무단전재 및 재배포 금지]",2017-04-13 11:43:04
